<?xml version="1.0" encoding="UTF-8"?>
<dataroot xmlns:od="urn:schemas-microsoft-com:officedata" xmlns:xsi="http://www.w3.org/2001/XMLSchema-instance"  xsi:noNamespaceSchemaLocation="Dishes.xsd" generated="2017-09-18T10:27:23">
<Dishes>
<DNum>D1</DNum>
<DishName>BBQbaconBurger</DishName>
<ListPrice>9.99</ListPrice>
<Calories>1200</Calories>
<CityOfOrigin>Houston</CityOfOrigin>
</Dishes>
<Dishes>
<DNum>D2</DNum>
<DishName>MeeKrob</DishName>
<ListPrice>24.99</ListPrice>
<Calories>600</Calories>
<CityOfOrigin>Boston</CityOfOrigin>
</Dishes>
<Dishes>
<DNum>D3</DNum>
<DishName>ChickenSatay</DishName>
<ListPrice>19.99</ListPrice>
<Calories>800</Calories>
<CityOfOrigin>NewOrleans</CityOfOrigin>
</Dishes>
<Dishes>
<DNum>D4</DNum>
<DishName>CashewChicken</DishName>
<ListPrice>9.99</ListPrice>
<Calories>1500</Calories>
<CityOfOrigin>Houston</CityOfOrigin>
</Dishes>
<Dishes>
<DNum>D5</DNum>
<DishName>BurritoGrande</DishName>
<ListPrice>9.99</ListPrice>
<Calories>1000</Calories>
<CityOfOrigin>Boston</CityOfOrigin>
</Dishes>
<Dishes>
<DNum>D6</DNum>
<DishName>SteamedDumpling</DishName>
<ListPrice>9.99</ListPrice>
<Calories>400</Calories>
<CityOfOrigin>Houston</CityOfOrigin>
</Dishes>
</dataroot>
